{"authority":{"assurance":"founder_attested","kind":"local-founder-bootstrap"},"created_at":"2026-07-19T23:00:00.000Z","identity_claims":[{"claim_id":"clm_11111111-1111-4111-8111-111111111111","issuer":{"kind":"provider","provider":"slack","tenant_id":"T123TEAM"},"principal_id":"prn_bbbbbbbb-bbbb-4bbb-8bbb-bbbbbbbbbbbb","subject":{"id":"U123FOUNDER","kind":"user"},"verification":{"assurance":"provider_challenge_observed","evidence_sha256":"sha256:553013def82dc2467c52f0ff444d2acd3ea2d1072dda073d0de1f70a3a484c9b","method":"slack_dm_challenge","verified_at":"2026-07-19T23:00:00.000Z"}}],"installation":{"device_class":"byod","device_id":"dev_dddddddd-dddd-4ddd-8ddd-dddddddddddd","enrolled_at":"2026-07-19T23:00:00.000Z","installation_id":"ins_eeeeeeee-eeee-4eee-8eee-eeeeeeeeeeee","membership_id":"mem_cccccccc-cccc-4ccc-8ccc-cccccccccccc","organization_id":"org_aaaaaaaa-aaaa-4aaa-8aaa-aaaaaaaaaaaa","product":{"name":"echo-brain","source_sha":"aaaaaaaaaaaaaaaaaaaaaaaaaaaaaaaaaaaaaaaa","version":"0.1.0-dev.6"},"signing_key":{"algorithm":"ecdsa-p256-sha256-der-low-s","assurance":"hardware_bound","key_id":"sha256:bfd16b896c8320ae199b684cdb03c6bb39d062442e4352fd4a2275ae1d826c70","protection":"secure-enclave","public_key_spki_der_base64":"MFkwEwYHKoZIzj0CAQYIKoZIzj0DAQcDQgAEYYK1oJVUbMX9BX0ZkrtIDgn0HW/0OutgYGCnoRO1meaRlTuxh6DEgd5oMR1gHEi3l5KAgZMH1Ds22FW3bCSDjw=="}},"integrity":{"canonicalization":"RFC8785","key_id":"sha256:bfd16b896c8320ae199b684cdb03c6bb39d062442e4352fd4a2275ae1d826c70","payload_sha256":"sha256:8a162e4c1b566672c509e4cdf61d54993a2a662b98f096524d292ee466b33ec0","signature_algorithm":"ecdsa-p256-sha256-der-low-s","signature_base64":"MEQCIH9CeYkj/8v3gPqoXno7OotugKMwTkQzcZVknYzCITStAiASUBcPJFgxDS3Ymhf37we90ku4hKcghxQwQutCJjQ3QQ=="},"kind":"echo-local-identity-manifest","legacy_cutover":{"declared_at":"2026-07-19T23:00:00.000Z","native_records_require":["source-attribution-v1","processor-attribution-v1","approval-context-v1","signed-outbox-v1"],"pre_cutover_default":"disposable_test"},"manifest_id":"idm_11111111-1111-4111-8111-111111111111","membership":{"membership_id":"mem_cccccccc-cccc-4ccc-8ccc-cccccccccccc","organization_id":"org_aaaaaaaa-aaaa-4aaa-8aaa-aaaaaaaaaaaa","principal_id":"prn_bbbbbbbb-bbbb-4bbb-8bbb-bbbbbbbbbbbb","status":"active","type":"owner","valid_from":"2026-07-19T23:00:00.000Z"},"organization":{"created_at":"2026-07-19T23:00:00.000Z","display_name":"Echo","organization_id":"org_aaaaaaaa-aaaa-4aaa-8aaa-aaaaaaaaaaaa"},"predecessor_manifest_id":null,"principal":{"display_name":"Founder","kind":"human","organization_id":"org_aaaaaaaa-aaaa-4aaa-8aaa-aaaaaaaaaaaa","principal_id":"prn_bbbbbbbb-bbbb-4bbb-8bbb-bbbbbbbbbbbb"},"schema_version":1}